{
  "schema_version": "1.0",
  "package": "robotics-assembly-foundation",
  "version": "0.1.0",
  "components": [
    {
      "id": "robotics.component.nema23_stepper_candidate.v1",
      "title": "NEMA 23-class stepper motor candidate",
      "kind": "stepper_motor",
      "vendor": "Unselected; Oriental Motor PKP is a research reference only",
      "data_status": "candidate",
      "engineering_review": "required",
      "summary": "A procurement candidate for the first belt-driven linear-axis demo. The frame label alone does not establish shaft, pilot, mounting-hole pattern, length, torque-speed curve, winding, driver, encoder, brake, or thermal capability.",
      "sources": ["oriental_motor_pkp_nema23_2026"],
      "interfaces": ["robotics.interface.nema23_motor_mount.candidate.v1", "robotics.interface.motor_shaft_to_timing_pulley.candidate.v1", "robotics.interface.motor_power_and_control.candidate.v1"],
      "facts": [
        {
          "name": "reference_product_family",
          "value": "Oriental Motor PKP 56.4 mm / NEMA 23 category",
          "basis": "source_specific",
          "source": "oriental_motor_pkp_nema23_2026",
          "note": "This is a research reference, not a selected motor or a transferable mounting specification."
        },
        {
          "name": "intended_demo_role",
          "value": "belt-driven linear-axis prime mover",
          "basis": "illustrative",
          "note": "Select only after payload, speed, acceleration, duty cycle, and holding requirements are known."
        }
      ],
      "required_selection_inputs": ["payload and moving mass", "travel, speed, acceleration, and duty cycle", "supply voltage and driver topology", "holding/vertical-axis requirement", "ambient temperature and enclosure", "exact supplier drawing and speed-torque curve"],
      "agent_guidance": "Never generate a motor plate, shaft coupling, wiring, torque calculation, or BOM line from the NEMA class alone. Require an exact part number and controlled drawing."
    },
    {
      "id": "robotics.component.hiwin_mg_linear_guide_candidate.v1",
      "title": "HIWIN MG-series miniature linear guideway candidate",
      "kind": "linear_guideway",
      "vendor": "HIWIN",
      "data_status": "candidate",
      "engineering_review": "required",
      "summary": "A compact linear-guide family candidate for axis and gripper carriage guidance. Exact rail size, block length, preload, accuracy class, lubrication, mounting, load/moment rating, and paired-rail configuration are unselected.",
      "sources": ["hiwin_mg_linear_guideways_2026"],
      "interfaces": ["robotics.interface.linear_guide_carriage_to_plate.candidate.v1", "robotics.interface.linear_guide_rail_to_structure.candidate.v1"],
      "facts": [
        {
          "name": "reference_product_family",
          "value": "MG Series miniature linear guideways",
          "basis": "source_specific",
          "source": "hiwin_mg_linear_guideways_2026"
        },
        {
          "name": "reference_family_variants",
          "value": "MGN narrow and MGW wide families",
          "basis": "source_specific",
          "source": "hiwin_mg_linear_guideways_2026",
          "note": "Family availability is not a selection or compatibility claim."
        },
        {
          "name": "intended_demo_role",
          "value": "carriage guidance",
          "basis": "illustrative"
        }
      ],
      "required_selection_inputs": ["moving mass", "external force and moment load cases", "required travel", "accuracy/repeatability target", "environment and lubrication plan", "rail/block exact drawing and preload class"],
      "agent_guidance": "Do not infer MGN/MGW dimensions or load ratings. Use the current exact HIWIN drawing and calculate load distribution and life with qualified review."
    },
    {
      "id": "robotics.component.gates_powergrip_gt3_belt_candidate.v1",
      "title": "Gates PowerGrip GT3 synchronous-belt candidate",
      "kind": "synchronous_belt",
      "vendor": "Gates Corporation",
      "data_status": "candidate",
      "engineering_review": "required",
      "summary": "A candidate family for a compact belt-driven linear axis. Profile, pitch, width, pitch length, pulley tooth count, tension, service factor, and belt clamp design remain unselected.",
      "sources": ["gates_powergrip_gt3_2026"],
      "interfaces": ["robotics.interface.timing_belt_drive.candidate.v1", "robotics.interface.belt_termination_to_carriage.candidate.v1"],
      "facts": [
        {
          "name": "reference_product_family",
          "value": "PowerGrip GT3 belts",
          "basis": "source_specific",
          "source": "gates_powergrip_gt3_2026"
        },
        {
          "name": "intended_demo_role",
          "value": "linear-axis motion transmission",
          "basis": "illustrative"
        }
      ],
      "required_selection_inputs": ["axis travel and packaging", "payload and acceleration", "desired speed", "pulley tooth count and shaft", "belt width and tension calculation", "vendor design-method result"],
      "agent_guidance": "Use only a profile-matched belt and pulley. Do not derive belt tension, allowable load, tooth engagement, or clamp geometry from this candidate record."
    },
    {
      "id": "robotics.component.timing_pulley_candidate.v1",
      "title": "Timing-pulley candidate",
      "kind": "timing_pulley",
      "data_status": "candidate",
      "engineering_review": "required",
      "summary": "A pulley to be selected with the exact belt profile and motor shaft. The bore, hub, keyway or clamp, retention method, concentricity, tooth count, and material are not defined by this record.",
      "sources": ["gates_powergrip_gt3_2026"],
      "interfaces": ["robotics.interface.motor_shaft_to_timing_pulley.candidate.v1", "robotics.interface.timing_belt_drive.candidate.v1"],
      "facts": [
        {
          "name": "intended_demo_role",
          "value": "motor or idler pulley in a synchronous belt path",
          "basis": "illustrative"
        }
      ],
      "required_selection_inputs": ["exact belt profile", "shaft drawing", "torque and radial load", "retention method", "balancing/runout requirement", "environment"],
      "agent_guidance": "Never assume a generic pulley profile, bore, or retention scheme. Link the selected pulley to its exact belt and shaft interfaces."
    },
    {
      "id": "robotics.component.linear_axis_structure.illustrative.v1",
      "title": "Linear-axis structural rail or frame",
      "kind": "structural_frame",
      "data_status": "illustrative",
      "engineering_review": "not_started",
      "summary": "Custom or modular structural member representing the axis backbone. It establishes assembly datums but has no material, extrusion family, cross section, stiffness, or fastener specification.",
      "sources": [],
      "interfaces": ["robotics.interface.linear_guide_rail_to_structure.candidate.v1", "robotics.interface.linear_axis_module_mount.illustrative.v1"],
      "facts": [
        {
          "name": "intended_demo_role",
          "value": "primary reference structure for linear-axis components",
          "basis": "illustrative"
        }
      ],
      "required_selection_inputs": ["span", "load cases", "deflection/accuracy requirement", "material/process", "mounting context", "corrosion/environmental requirements"],
      "agent_guidance": "Model this only as a placeholder envelope until a structural calculation and material/process selection have been reviewed."
    },
    {
      "id": "robotics.component.linear_axis_carriage_plate.illustrative.v1",
      "title": "Linear-axis carriage plate",
      "kind": "custom_machined_or_sheet_part",
      "data_status": "illustrative",
      "engineering_review": "not_started",
      "summary": "A custom plate that joins guide blocks, belt termination, and the payload interface. Exact material, thickness, tolerances, stiffness, and fasteners are unselected.",
      "sources": [],
      "interfaces": ["robotics.interface.linear_guide_carriage_to_plate.candidate.v1", "robotics.interface.belt_termination_to_carriage.candidate.v1", "robotics.interface.linear_axis_module_mount.illustrative.v1"],
      "facts": [
        {
          "name": "intended_demo_role",
          "value": "moving payload carrier",
          "basis": "illustrative"
        }
      ],
      "required_selection_inputs": ["guide-block pattern", "belt clamp drawing", "payload interface", "load/moment cases", "material/process", "tolerance and datum scheme"],
      "agent_guidance": "Do not dimension this part until the exact guide block, belt clamp, payload, datum scheme, and load case are present."
    },
    {
      "id": "robotics.component.linear_axis_motor_mount.illustrative.v1",
      "title": "Linear-axis motor mount",
      "kind": "custom_machined_or_sheet_part",
      "data_status": "illustrative",
      "engineering_review": "not_started",
      "summary": "A custom bracket or plate to locate an exact motor and establish pulley alignment. It contains no released motor pattern, plate thickness, material, or resonance assessment.",
      "sources": [],
      "interfaces": ["robotics.interface.nema23_motor_mount.candidate.v1", "robotics.interface.linear_axis_module_mount.illustrative.v1"],
      "facts": [
        {
          "name": "intended_demo_role",
          "value": "motor-to-structure adapter",
          "basis": "illustrative"
        }
      ],
      "required_selection_inputs": ["exact motor drawing", "pulley/belt line", "structure datum", "stiffness and vibration target", "fabrication process", "fastener strategy"],
      "agent_guidance": "Do not assign mounting holes from the motor class. Generate this part only from an exact controlled motor drawing."
    },
    {
      "id": "robotics.component.axis_endstop_candidate.v1",
      "title": "Linear-axis end-stop and homing sensor candidate",